"Variable_Name","Variable_Label","Group0_Rate","Group1_Rate","Rate_Difference","P_Value","Test_Used","Domain","Data_Source","N_Group0","N_Group1","Min_Expected","Significance"
"ACS_PCT_SAME_SEX_UNMRD_PRTNR_census_tractlevel","Percentage of households with same-sex unmarried partner",6.35386771674565,7.53484320557491,1.18097548882927,0.0365798584453161,"Chi-square","1. social context","ACS",14983,2296,149.487817582036,"*"
"ACS_PCT_SPANISH_census_tractlevel","Percentage of population that speaks Spanish (ages 5 and over)",6.35386771674565,7.53484320557491,1.18097548882927,0.0365798584453161,"Chi-square","1. social context","ACS",14983,2296,149.487817582036,"*"
"ACS_PCT_TAXICAB_2WORK_census_tractlevel","Percentage of workers taking taxicab, motorcycle, bicycle, or other means to work (ages 16 and over)",6.35386771674565,7.53484320557491,1.18097548882927,0.0365798584453161,"Chi-square","4. physical infrastructure","ACS",14983,2296,149.487817582036,"*"
"ACS_PCT_TRANSPORT_census_tractlevel","Percentage of employed working in transportation and warehousing, and in utilities (ages 16 and over)",6.35386771674565,7.53484320557491,1.18097548882927,0.0365798584453161,"Chi-square","2. economic context","ACS",14983,2296,149.487817582036,"*"
"ACS_PCT_UNEMPLOY_census_tractlevel","Percentage of civilian labor force that is unemployed (ages 16 and over)",6.35386771674565,7.53484320557491,1.18097548882927,0.0365798584453161,"Chi-square","2. economic context","ACS",14983,2296,149.487817582036,"*"
"ACS_PCT_VACANT_HU_census_tractlevel","Percentage of housing units vacant",6.35386771674565,7.53484320557491,1.18097548882927,0.0365798584453161,"Chi-square","4. physical infrastructure","ACS",14983,2296,149.487817582036,"*"
"ACS_PCT_VET_census_tractlevel","Percentage of the civilian population consisting of veterans (ages 18 and over)",6.35386771674565,7.53484320557491,1.18097548882927,0.0365798584453161,"Chi-square","1. social context","ACS",14983,2296,149.487817582036,"*"
"ACS_PCT_WALK_2WORK_census_tractlevel","Percentage of workers walking to work (ages 16 and over)",6.35386771674565,7.53484320557491,1.18097548882927,0.0365798584453161,"Chi-square","4. physical infrastructure","ACS",14983,2296,149.487817582036,"*"
"ACS_PCT_WHITE_census_tractlevel","Percentage of population reporting White race alone",6.35386771674565,7.53484320557491,1.18097548882927,0.0365798584453161,"Chi-square","1. social context","ACS",14983,2296,149.487817582036,"*"
"ACS_PCT_WHITE_COMB_census_tractlevel","Percentage of population reporting White alone or in combination with one or more races",6.35386771674565,7.53484320557491,1.18097548882927,0.0365798584453161,"Chi-square","1. social context","ACS",14983,2296,149.487817582036,"*"
"ACS_PCT_WHITE_NONHISP_census_tractlevel","Percentage of non-Hispanic population reporting White race alone",6.35386771674565,7.53484320557491,1.18097548882927,0.0365798584453161,"Chi-square","1. social context","ACS",14983,2296,149.487817582036,"*"
"ACS_PCT_WHOLESALE_census_tractlevel","Percentage of employed working in wholesale trade (ages 16 and over)",6.35386771674565,7.53484320557491,1.18097548882927,0.0365798584453161,"Chi-square","2. economic context","ACS",14983,2296,149.487817582036,"*"
"ACS_PCT_WIDOWED_F_census_tractlevel","Percentage of female population now widowed (ages 15 and over)",6.35386771674565,7.53484320557491,1.18097548882927,0.0365798584453161,"Chi-square","1. social context","ACS",14983,2296,149.487817582036,"*"
"ACS_PCT_WIDOWED_M_census_tractlevel","Percentage of male population now widowed (ages 15 and over)",6.35386771674565,7.53484320557491,1.18097548882927,0.0365798584453161,"Chi-square","1. social context","ACS",14983,2296,149.487817582036,"*"
"ACS_PCT_WORK_RES_M_census_tractlevel","Percentage of male population who worked in place of residence (ages 16 and over)",6.35386771674565,7.53484320557491,1.18097548882927,0.0365798584453161,"Chi-square","2. economic context","ACS",14983,2296,149.487817582036,"*"
"ACS_PER_CAPITA_INC_census_tractlevel","Per capita income (dollars, inflation-adjusted to data file year)",6.35386771674565,7.53484320557491,1.18097548882927,0.0365798584453161,"Chi-square","2. economic context","ACS",14983,2296,149.487817582036,"*"
"ACS_TOT_CIVIL_EMPLOY_POP_census_tractlevel","Total civilian employed population (ages 16 and over)",6.35386771674565,7.53484320557491,1.18097548882927,0.0365798584453161,"Chi-square","2. economic context","ACS",14983,2296,149.487817582036,"*"
"ACS_TOT_CIVIL_POP_ABOVE18_census_tractlevel","Total civilian population (ages 18 and over)",6.35386771674565,7.53484320557491,1.18097548882927,0.0365798584453161,"Chi-square","1. social context","ACS",14983,2296,149.487817582036,"*"
"ACS_TOT_CIVIL_VET_POP_census_tractlevel","Total number of civilian veterans (ages 18 and over)",6.35386771674565,7.53484320557491,1.18097548882927,0.0365798584453161,"Chi-square","1. social context","ACS",14983,2296,149.487817582036,"*"
"ACS_TOT_CIVIL_VET_POP_ABOVE25_census_tractlevel","Total civilian population who are veterans (ages 25 and over)",6.35386771674565,7.53484320557491,1.18097548882927,0.0365798584453161,"Chi-square","1. social context","ACS",14983,2296,149.487817582036,"*"
"ACS_TOT_GRANDCHILDREN_GP_census_tractlevel","Total grandchildren under 18 living with grandparent householder",6.35386771674565,7.53484320557491,1.18097548882927,0.0365798584453161,"Chi-square","1. social context","ACS",14983,2296,149.487817582036,"*"
"ACS_TOT_HH_census_tractlevel","Total number of households",6.35386771674565,7.53484320557491,1.18097548882927,0.0365798584453161,"Chi-square","1. social context","ACS",14983,2296,149.487817582036,"*"
"ACS_TOT_HU_census_tractlevel","Total housing units",6.35386771674565,7.53484320557491,1.18097548882927,0.0365798584453161,"Chi-square","4. physical infrastructure","ACS",14983,2296,149.487817582036,"*"
"ACS_TOT_OWN_CHILD_BELOW17_census_tractlevel","Total own children (ages 17 and below)",6.35386771674565,7.53484320557491,1.18097548882927,0.0365798584453161,"Chi-square","1. social context","ACS",14983,2296,149.487817582036,"*"
"ACS_TOT_POP_16_19_census_tractlevel","Total population (between ages 16 and 19)",6.35386771674565,7.53484320557491,1.18097548882927,0.0365798584453161,"Chi-square","1. social context","ACS",14983,2296,149.487817582036,"*"
"ACS_TOT_POP_ABOVE15_census_tractlevel","Total population (ages 15 and over)",6.35386771674565,7.53484320557491,1.18097548882927,0.0365798584453161,"Chi-square","1. social context","ACS",14983,2296,149.487817582036,"*"
"ACS_TOT_POP_ABOVE16_census_tractlevel","Total population (ages 16 and over)",6.35386771674565,7.53484320557491,1.18097548882927,0.0365798584453161,"Chi-square","1. social context","ACS",14983,2296,149.487817582036,"*"
"ACS_TOT_POP_ABOVE25_census_tractlevel","Total population (ages 25 and over)",6.35386771674565,7.53484320557491,1.18097548882927,0.0365798584453161,"Chi-square","1. social context","ACS",14983,2296,149.487817582036,"*"
"ACS_TOT_POP_ABOVE5_census_tractlevel","Total population (ages 5 and over)",6.35386771674565,7.53484320557491,1.18097548882927,0.0365798584453161,"Chi-square","1. social context","ACS",14983,2296,149.487817582036,"*"
"ACS_TOT_POP_POV_census_tractlevel","Total population for whom poverty status is determined",6.35386771674565,7.53484320557491,1.18097548882927,0.0365798584453161,"Chi-square","2. economic context","ACS",14983,2296,149.487817582036,"*"
"ACS_TOT_POP_US_ABOVE1_census_tractlevel","Total population in the U.S. (ages 1 and over)",6.35386771674565,7.53484320557491,1.18097548882927,0.0365798584453161,"Chi-square","1. social context","ACS",14983,2296,149.487817582036,"*"
"ACS_TOT_POP_WT_census_tractlevel","Total weighted population",6.35386771674565,7.53484320557491,1.18097548882927,0.0365798584453161,"Chi-square","1. social context","ACS",14983,2296,149.487817582036,"*"
"ACS_TOT_CIVILIAN_LABOR_census_tractlevel","Total population in the civilian labor force (ages 16 and over)",6.35386771674565,7.53484320557491,1.18097548882927,0.0365798584453161,"Chi-square","2. economic context","ACS",14983,2296,149.487817582036,"*"
"ACS_TOT_WORKER_HH_census_tractlevel","Total workers in households (ages 16 and over)",6.35386771674565,7.53484320557491,1.18097548882927,0.0365798584453161,"Chi-square","2. economic context","ACS",14983,2296,149.487817582036,"*"
"ACS_TOT_WORKER_NWFH_census_tractlevel","Total workers who do not work from home (ages 16 and over)",6.35386771674565,7.53484320557491,1.18097548882927,0.0365798584453161,"Chi-square","2. economic context","ACS",14983,2296,149.487817582036,"*"
"WUSTL_AVG_PM25_census_tractlevel","Annual mean of Particulate Matter (PM2.5) concentration (μg/m3)",6.35386771674565,7.53484320557491,1.18097548882927,0.0365798584453161,"Chi-square","4. physical infrastructure","WUSTL",14983,2296,149.487817582036,"*"
"ACS_PCT_POV_WHITE_census_tractlevel","Percentage of White, not Hispanic population below poverty level",6.40058733230995,7.57839721254355,1.1778098802336,0.0377241870622392,"Chi-square","2. economic context","ACS",14983,2296,150.550842062619,"*"
"SEDA_CS_TOT_MATH_GR8_HSP_countylevel","Grade 8 Math Sample size, Hispanic students",3.030100780885,2.2212543554007,-0.808846425484306,0.0378846561089847,"Chi-square","3. education","SEDA",14983,2296,67.103420336825,"*"
"ACS_MEDIAN_INC_M_census_tractlevel","Median income of male population (dollars, ages 15 and over with income in the past 12 months, inflation-adjusted to data file year)",6.60748848695188,7.79616724738676,1.18867876043488,0.0387163760019409,"Chi-square","2. economic context","ACS",14983,2296,155.334452225245,"*"
"ACS_MDN_OWNER_COST_MORTGAGE_census_tractlevel","Median selected monthly owner costs for houses with a mortgage (dollars)",6.48735233264366,7.66550522648084,1.17815289383717,0.0388479596845614,"Chi-square","4. physical infrastructure","ACS",14983,2296,152.544012963713,"*"
"ACS_AVG_HH_SIZE_census_tractlevel","Average household size",6.36721617833545,7.53484320557491,1.16762702723947,0.0389632423043108,"Chi-square","1. social context","ACS",14983,2296,149.753573702182,"*"
"ACS_GINI_INDEX_census_tractlevel","Gini index of income inequality",6.36721617833545,7.53484320557491,1.16762702723947,0.0389632423043108,"Chi-square","2. economic context","ACS",14983,2296,149.753573702182,"*"
"ACS_PCT_INC50_ABOVE65_census_tractlevel","Percentage of population with income to poverty ratio under 0.50 (ages 65 and over)",6.36721617833545,7.53484320557491,1.16762702723947,0.0389632423043108,"Chi-square","2. economic context","ACS",14983,2296,149.753573702182,"*"
"ACS_PCT_WORK_NO_CAR_census_tractlevel","Percentage of workers in households with no vehicle available (ages 16 and over)",6.36721617833545,7.53484320557491,1.16762702723947,0.0389632423043108,"Chi-square","4. physical infrastructure","ACS",14983,2296,149.753573702182,"*"
"ACS_MEDIAN_HOME_VALUE_census_tractlevel","Median home value of owner-occupied housing units (dollars)",6.45398117866916,7.6219512195122,1.16797004084304,0.0401171952608066,"Chi-square","4. physical infrastructure","ACS",14983,2296,151.746744603276,"*"
"ACS_MEDIAN_HH_INC_census_tractlevel","Median household income (dollars, inflation-adjusted to data file year)",6.37389040913035,7.53484320557491,1.16095279644457,0.0402019644343755,"Chi-square","2. economic context","ACS",14983,2296,149.886451762255,"*"
"ACS_PCT_NO_WORK_NO_SCHL_16_19_census_tractlevel","Percentage of teens and adults who are unemployed and not in school (between ages 16 and 19)",6.66755656410599,7.8397212543554,1.17216469024941,0.0423749192595664,"Chi-square","3. education","ACS",14983,2296,156.663232825974,"*"
"ACS_MEDIAN_INC_F_census_tractlevel","Median income of female population (dollars, ages 15 and over with income in the past 12 months, inflation-adjusted to data file year)",6.62751117933658,7.79616724738676,1.16865606805018,0.0424375687979118,"Chi-square","2. economic context","ACS",14983,2296,155.733086405463,"*"
"ACS_PCT_1UP_RENT_1ROOM_census_tractlevel","Percentage of renter-occupied housing units with more than one occupant per room",6.39391310151505,7.53484320557491,1.14093010405986,0.0441132810767358,"Chi-square","4. physical infrastructure","ACS",14983,2296,150.285085942474,"*"
"ACS_PCT_RENTER_HU_ABOVE65_census_tractlevel","Percentage of renter-occupied housing units occupied by householders aged 65 and above",6.39391310151505,7.53484320557491,1.14093010405986,0.0441132810767358,"Chi-square","4. physical infrastructure","ACS",14983,2296,150.285085942474,"*"
"ACS_PCT_RENTER_HU_CHILD_census_tractlevel","Percentage of renter-occupied housing units with children",6.39391310151505,7.53484320557491,1.14093010405986,0.0441132810767358,"Chi-square","4. physical infrastructure","ACS",14983,2296,150.285085942474,"*"
"CCBP_PHYS_RATE_countylevel","Total number of physician offices per 1,000 people",1.24808115864647,0.740418118466899,-0.507663040179567,0.0462196279266828,"Chi-square","4. physical infrastructure","CCBP",14983,2296,27.1071242548759,"*"
"ACS_PCT_RENTER_HU_COST_30PCT_census_tractlevel","Percentage of renter-occupied housing units with rent equal to 30 percent or more of household income",6.42728425548955,7.53484320557491,1.10755895008536,0.0513183247595854,"Chi-square","4. physical infrastructure","ACS",14983,2296,150.949476242838,""
"ACS_PCT_RENTER_HU_COST_50PCT_census_tractlevel","Percentage of renter-occupied housing units with rent equal to 50 percent or more of household income",6.42728425548955,7.53484320557491,1.10755895008536,0.0513183247595854,"Chi-square","4. physical infrastructure","ACS",14983,2296,150.949476242838,""
"SEDA_CS_MN_ELA_GR8_BLK_countylevel","Grade 8 ELA Mean Cohort Scale (CS), Black or African American students
",8.33611426283121,7.14285714285714,-1.19325711997407,0.0571566549009827,"Chi-square","3. education","SEDA",14983,2296,187.756698883037,""
"ACS_PCT_POV_AIAN_countylevel","Percentage of American Indian or Alaska Native population below poverty level",2.44944270172863,1.78571428571429,-0.66372841601434,0.0605663797328729,"Chi-square","2. economic context","ACS",14983,2296,54.2142485097517,""
"CDCAP_HIVDIAG_BLK_RATE_ABOVE13_countylevel","Total number of people living with diagnosed HIV at the end of the year per 100,000, Black non-Hispanic (ages 13 and over)",4.15137155442835,3.31010452961672,-0.841267024811628,0.0643679809856465,"Chi-square","5. healthcare context","CDCAP",14983,2296,92.7488859308988,""
"ACS_MEDIAN_YEAR_BUILT_census_tractlevel","Median year structure built of housing units",6.60748848695188,7.66550522648084,1.05801673952896,0.066174072121095,"Chi-square","4. physical infrastructure","ACS",14983,2296,154.935818045026,""
"CDCAP_HIVDIAG_WHT_RATE_ABOVE13_countylevel","Total number of people living with diagnosed HIV at the end of the year per 100,000, White non-Hispanic (ages 13 and over)",3.65080424481079,2.87456445993031,-0.776239784880472,0.0700164250067276,"Chi-square","5. healthcare context","CDCAP",14983,2296,81.4542508247005,""
"ACS_PCT_MULT_RACE_FEMALE_census_tractlevel","Percentage of population reporting two or more races and female",13.0681438964159,14.4163763066202,1.34823241020427,0.0815987011398413,"Chi-square","1. social context","ACS",14983,2296,304.157879506916,""
"ACS_PCT_MULT_RACE_MALE_census_tractlevel","Percentage of population reporting two or more races and male",13.0681438964159,14.4163763066202,1.34823241020427,0.0815987011398413,"Chi-square","1. social context","ACS",14983,2296,304.157879506916,""
"SEDA_CS_TOT_ELA_GR8_HSP_countylevel","Grade 8 ELA Sample size, Hispanic students",8.05579656944537,9.14634146341463,1.09054489396926,0.083161351699678,"Chi-square","3. education","SEDA",14983,2296,188.288211123329,""
"ACS_MDN_OWNER_COST_NO_MORTG_census_tractlevel","Median selected monthly owner costs for houses without a mortgage (dollars)",6.92117733431222,7.92682926829268,1.00565193398046,0.087529476437545,"Chi-square","4. physical infrastructure","ACS",14983,2296,161.978355228891,""
"SEDA_CS_MN_MATH_GR3_WHT_countylevel","Grade 3 Math Mean Cohort Scale (CS), White students",1.62851231395582,1.13240418118467,-0.496108132771148,0.0901724040025481,"Chi-square","3. education","SEDA",14983,2296,35.8770762196886,""
"SEDA_CS_MN_ELA_GR3_ALL_countylevel","Grade 3 ELA Mean Cohort Scale (CS), All students
",0.37375692451445,0.130662020905923,-0.243094903608526,0.0954497949516423,"Chi-square","3. education","SEDA",14983,2296,7.83980554430233,""
"CCBP_FSR_RATE_countylevel","Total number of full service restaurants per 1,000 people",0.607355002335981,0.304878048780488,-0.302476953555493,0.0993538882603157,"Chi-square","4. physical infrastructure","CCBP",14983,2296,13.0220498871462,""
"ACS_PCT_AIAN_FEMALE_countylevel","Percentage of American Indian and Alaska Native alone population reporting female",2.05566308482947,1.52439024390244,-0.531272840927034,0.105421575537362,"Chi-square","1. social context","ACS",14983,2296,45.5771746050119,""
"ACS_PCT_AIAN_MALE_countylevel","Percentage of American Indian and Alaska Native alone population reporting male",2.05566308482947,1.52439024390244,-0.531272840927034,0.105421575537362,"Chi-square","1. social context","ACS",14983,2296,45.5771746050119,""
"ACS_PCT_POV_MULTI_census_tractlevel","Percentage of two or more races population below poverty level",13.7155442835213,14.9825783972125,1.26703411369122,0.109025826523612,"Chi-square","2. economic context","ACS",14983,2296,318.774466114937,""
"ACS_MEDIAN_HH_INC_BLACK_census_tractlevel","Median household income for households with a Black or African American alone householder (dollars, inflation-adjusted to data file year)",21.9048254688647,20.4703832752613,-1.43444219360339,0.127211163832342,"Chi-square","2. economic context","ACS",14983,2296,498.558481393599,""
"SEDA_CS_TOT_ELA_GR3_ALL_countylevel","Grade 3 ELA Sample Size, All students
",0.347060001334846,0.130662020905923,-0.216397980428923,0.129717656234445,"Chi-square","3. education","SEDA",14983,2296,7.30829330401065,""
"ACS_MEDIAN_NONVET_INC_census_tractlevel","Median income of civilian nonveteran population (dollars, ages 18 and over, inflation-adjusted to data file year)",8.85003003403858,9.84320557491289,0.993175540874315,0.130864444585307,"Chi-square","2. economic context","ACS",14983,2296,206.226749233173,""
"SEDA_CS_MN_ELA_GR3_HSP_countylevel","Grade 3 ELA Mean Cohort Scale (CS), Hispanic students
",28.1118601081225,29.6602787456446,1.54841863752206,0.131397378927288,"Chi-square","3. education","SEDA",14983,2296,650.172347936802,""
"CCBP_FF_RATE_countylevel","Total number of limited service restaurants (fast food establishments) per 1,000 people",0.280317693385837,0.0871080139372822,-0.193209679448555,0.136691295443772,"Chi-square","4. physical infrastructure","CCBP",14983,2296,5.84663464320852,""
"SEDA_ELA_GR3_WHG_countylevel","Grade 3 ELA Cohort Scale (CS) Gap, White-Hispanic",28.1786024160715,29.7038327526132,1.5252303365417,0.137638716801218,"Chi-square","3. education","SEDA",14983,2296,651.634006597604,""
"ACS_PCT_POV_OTHER_countylevel","Percentage of some other race population below poverty level",0.787559233798305,0.479094076655052,-0.308465157143253,0.141905523934063,"Chi-square","2. economic context","ACS",14983,2296,17.1412697494068,""
"SEDA_CS_TOT_MATH_GR3_HSP_countylevel","Grade 3 Math Sample Size, Hispanic students
",2.19582193152239,1.698606271777,-0.497215659745389,0.144550123398375,"Chi-square","3. education","SEDA",14983,2296,48.8991261068349,""
"SEDA_CS_MN_MATH_GR3_ALL_countylevel","Grade 3 Math Mean Cohort Scale (CS), All students",0.614029233130882,0.348432055749129,-0.265597177381753,0.157189127433708,"Chi-square","3. education","SEDA",14983,2296,13.2878060072921,""
"ACS_MEDIAN_NONVET_INC_countylevel","Median income of civilian nonveteran population (dollars, ages 18 and over, inflation-adjusted to data file year)",0.874324234132016,0.566202090592335,-0.308122143539682,0.164815402218517,"Chi-square","2. economic context","ACS",14983,2296,19.1344406505006,""
"ACS_MEDIAN_VET_INC_countylevel","Median income of civilian veterans (dollars, ages 18 and over, inflation-adjusted to data file year)",0.874324234132016,0.566202090592335,-0.308122143539682,0.164815402218517,"Chi-square","2. economic context","ACS",14983,2296,19.1344406505006,""
"SEDA_CS_MN_ELA_GR8_WHT_countylevel","Grade 8 ELA Mean Cohort Scale (CS), White students
",3.60408462924648,3.00522648083624,-0.598858148410243,0.165042751114578,"Chi-square","3. education","SEDA",14983,2296,80.9227385844088,""
"CDCA_PREV_DTH_BLACK_RATE_BELOW74_countylevel","Total avoidable heart disease and stroke deaths per 100,000 Black non-Hispanic population (ages 74 and below)",1.82206500700794,1.39372822299652,-0.428336784011426,0.171843357424059,"Chi-square","5. healthcare context","CDCA",14983,2296,40.5278083222409,""
"CDCW_TRANSPORT_DTH_RATE_countylevel","Total number of deaths from transport accidents per 100,000 population",0.707468464259494,0.435540069686411,-0.271928394573083,0.177459335010355,"Chi-square","5. healthcare context","CDCW",14983,2296,15.4138549684588,""
"SEDA_CS_TOT_MATH_GR3_WHT_countylevel","Grade 3 Math Sample Size, White students
",1.26810385103117,0.914634146341463,-0.353469704689705,0.182203183790169,"Chi-square","3. education","SEDA",14983,2296,28.0372706753863,""
"CHR_PREMAT_DEATH_RATE_countylevel","Total number of premature deaths: age-adjusted per 100,000 population (ages 74 and below)",21.1506373890409,22.3867595818815,1.23612219284062,0.187026533964429,"Chi-square","5. healthcare context","CHR",14983,2296,489.389895248568,""
"CDCW_SELFHARM_DTH_RATE_countylevel","Total number of deaths from intentional self harm per 100,000 population",2.81652539544817,2.30836236933798,-0.508163026110195,0.187435395797393,"Chi-square","5. healthcare context","CDCW",14983,2296,63.1170785346374,""
"CHR_PCT_LOW_BIRTH_WT_countylevel","Percentage of live births with low birthweight (<2,500 grams)",10.6253754254822,9.71254355400697,-0.912831871475245,0.196400632733977,"Chi-square","5. healthcare context","CHR",14983,2296,241.173679032351,""
"CHR_TEEN_BIRTH_RATE_15_19_countylevel","Total number of births per 1,000 females (ages 15-19)",10.6253754254822,9.71254355400697,-0.912831871475245,0.196400632733977,"Chi-square","5. healthcare context","CHR",14983,2296,241.173679032351,""
"AHRF_ARBRNE_ST_G_ISO_HOSPS_RATE_countylevel","Total number of short-term general hospitals with airborne infection isolation rooms per 1,000 population",10.6120269638924,9.71254355400697,-0.899483409885443,0.202993888670085,"Chi-square","5. healthcare context","AHRF",14983,2296,240.907922912206,""
"AHRF_CARDIAC_IC_BEDS_RATE_countylevel","Total number of short-term general hospital cardiac intensive care beds per 1,000 population",10.6120269638924,9.71254355400697,-0.899483409885443,0.202993888670085,"Chi-square","5. healthcare context","AHRF",14983,2296,240.907922912206,""
"AHRF_CARDIAC_IC_HOSP_RATE_countylevel","Total number of short-term general hospitals with cardiac intensive care per 1,000 population",10.6120269638924,9.71254355400697,-0.899483409885443,0.202993888670085,"Chi-square","5. healthcare context","AHRF",14983,2296,240.907922912206,""
"AHRF_HOSP_MOBILE_RATE_countylevel","Total number of hospitals with mobile health services per 1,000 population",10.6120269638924,9.71254355400697,-0.899483409885443,0.202993888670085,"Chi-square","5. healthcare context","AHRF",14983,2296,240.907922912206,""
"AHRF_HOSP_TEACHING_countylevel","Total number of teaching hospitals",10.6120269638924,9.71254355400697,-0.899483409885443,0.202993888670085,"Chi-square","5. healthcare context","AHRF",14983,2296,240.907922912206,""
"AHRF_MEDSURGIC_BEDS_RATE_countylevel","Total number of short-term general hospital intensive care beds per 1,000 population",10.6120269638924,9.71254355400697,-0.899483409885443,0.202993888670085,"Chi-square","5. healthcare context","AHRF",14983,2296,240.907922912206,""
"AHRF_MEDSURGIC_HOSP_RATE_countylevel","Total number of short-term general hospitals with medical surgical intensive care per 1,000 population",10.6120269638924,9.71254355400697,-0.899483409885443,0.202993888670085,"Chi-square","5. healthcare context","AHRF",14983,2296,240.907922912206,""
"AHRF_NEONATALIC_BEDS_RATE_countylevel","Total number of short-term general hospital neonatal intensive care beds per 1,000 population",10.6120269638924,9.71254355400697,-0.899483409885443,0.202993888670085,"Chi-square","5. healthcare context","AHRF",14983,2296,240.907922912206,""
"AHRF_NEONATALIC_HOSP_RATE_countylevel","Total number of short-term general hospitals with neonatal intensive care per 1,000 population",10.6120269638924,9.71254355400697,-0.899483409885443,0.202993888670085,"Chi-square","5. healthcare context","AHRF",14983,2296,240.907922912206,""
"AHRF_RURL_REFRRL_CNT_RATE_countylevel","Total number of rural referral centers per 1,000 population",10.6120269638924,9.71254355400697,-0.899483409885443,0.202993888670085,"Chi-square","5. healthcare context","AHRF",14983,2296,240.907922912206,""
"AHRF_TOT_ARBRNE_ST_G_ISO_HOSPS_countylevel","Total number of short-term general hospitals with airborne infection isolation rooms",10.6120269638924,9.71254355400697,-0.899483409885443,0.202993888670085,"Chi-square","5. healthcare context","AHRF",14983,2296,240.907922912206,""
"AHRF_TOT_CARDIAC_IC_BEDS_countylevel","Total number of short-term general hospital cardiac intensive care beds",10.6120269638924,9.71254355400697,-0.899483409885443,0.202993888670085,"Chi-square","5. healthcare context","AHRF",14983,2296,240.907922912206,""
"AHRF_TOT_CARDIAC_IC_HOSP_countylevel","Total number of short-term general hospitals with cardiac intensive care",10.6120269638924,9.71254355400697,-0.899483409885443,0.202993888670085,"Chi-square","5. healthcare context","AHRF",14983,2296,240.907922912206,""
